[INFO] Scanning for projects...
[INFO] 
[INFO] ------------------< com.logintest:login-form-testing >------------------
[INFO] Building login-form-testing 1.0-SNAPSHOT
[INFO]   from pom.xml
[INFO] --------------------------------[ jar ]---------------------------------
[INFO] 
[INFO] --- resources:3.3.1:resources (default-resources) @ login-form-testing ---
[WARNING] Using platform encoding (UTF-8 actually) to copy filtered resources, i.e. build is platform dependent!
[INFO] skip non existing resourceDirectory /Users/ganeshilluri/Documents/Skill Palaver Project/Maven_Testing_Project/src/main/resources
[INFO] 
[INFO] --- compiler:3.13.0:compile (default-compile) @ login-form-testing ---
[INFO] Recompiling the module because of added or removed source files.
[WARNING] File encoding has not been set, using platform encoding UTF-8, i.e. build is platform dependent!
[INFO] Compiling 4 source files with javac [debug target 17] to target/classes
[WARNING] system modules path not set in conjunction with -source 17
[INFO] 
[INFO] --- resources:3.3.1:testResources (default-testResources) @ login-form-testing ---
[WARNING] Using platform encoding (UTF-8 actually) to copy filtered resources, i.e. build is platform dependent!
[INFO] skip non existing resourceDirectory /Users/ganeshilluri/Documents/Skill Palaver Project/Maven_Testing_Project/src/test/resources
[INFO] 
[INFO] --- compiler:3.13.0:testCompile (default-testCompile) @ login-form-testing ---
[INFO] Recompiling the module because of changed dependency.
[WARNING] File encoding has not been set, using platform encoding UTF-8, i.e. build is platform dependent!
[INFO] Compiling 5 source files with javac [debug target 17] to target/test-classes
[WARNING] system modules path not set in conjunction with -source 17
[INFO] 
[INFO] --- surefire:3.2.3:test (default-test) @ login-form-testing ---
[INFO] Using auto detected provider org.apache.maven.surefire.testng.TestNGProvider
[INFO] 
[INFO] -------------------------------------------------------
[INFO]  T E S T S
[INFO] -------------------------------------------------------
[INFO] Running TestSuite
SLF4J: Failed to load class "org.slf4j.impl.StaticLoggerBinder".
SLF4J: Defaulting to no-operation (NOP) logger implementation
SLF4J: See http://www.slf4j.org/codes.html#StaticLoggerBinder for further details.
Database connected successfully!
Feb 21, 2026 9:27:17 PM org.openqa.selenium.devtools.CdpVersionFinder findNearestMatch
WARNING: Unable to find CDP implementation matching 145
Feb 21, 2026 9:27:17 PM org.openqa.selenium.chromium.ChromiumDriver lambda$new$5
WARNING: Unable to find version of CDP to use for 145.0.7632.76. You may need to include a dependency on a specific version of the CDP using something similar to `org.seleniumhq.selenium:selenium-devtools-v86:4.16.1` where the version ("v86") matches the version of the chromium-based browser you're using and the version number of the artifact is the same as Selenium's.
Feb 21, 2026 9:27:19 PM org.openqa.selenium.devtools.CdpVersionFinder findNearestMatch
WARNING: Unable to find CDP implementation matching 145
Feb 21, 2026 9:27:19 PM org.openqa.selenium.chromium.ChromiumDriver lambda$new$5
WARNING: Unable to find version of CDP to use for 145.0.7632.76. You may need to include a dependency on a specific version of the CDP using something similar to `org.seleniumhq.selenium:selenium-devtools-v86:4.16.1` where the version ("v86") matches the version of the chromium-based browser you're using and the version number of the artifact is the same as Selenium's.
Feb 21, 2026 9:27:20 PM org.openqa.selenium.devtools.CdpVersionFinder findNearestMatch
WARNING: Unable to find CDP implementation matching 145
Feb 21, 2026 9:27:20 PM org.openqa.selenium.chromium.ChromiumDriver lambda$new$5
WARNING: Unable to find version of CDP to use for 145.0.7632.76. You may need to include a dependency on a specific version of the CDP using something similar to `org.seleniumhq.selenium:selenium-devtools-v86:4.16.1` where the version ("v86") matches the version of the chromium-based browser you're using and the version number of the artifact is the same as Selenium's.
Feb 21, 2026 9:27:21 PM org.openqa.selenium.devtools.CdpVersionFinder findNearestMatch
WARNING: Unable to find CDP implementation matching 145
Feb 21, 2026 9:27:21 PM org.openqa.selenium.chromium.ChromiumDriver lambda$new$5
WARNING: Unable to find version of CDP to use for 145.0.7632.76. You may need to include a dependency on a specific version of the CDP using something similar to `org.seleniumhq.selenium:selenium-devtools-v86:4.16.1` where the version ("v86") matches the version of the chromium-based browser you're using and the version number of the artifact is the same as Selenium's.
Feb 21, 2026 9:27:23 PM org.openqa.selenium.devtools.CdpVersionFinder findNearestMatch
WARNING: Unable to find CDP implementation matching 145
Feb 21, 2026 9:27:23 PM org.openqa.selenium.chromium.ChromiumDriver lambda$new$5
WARNING: Unable to find version of CDP to use for 145.0.7632.76. You may need to include a dependency on a specific version of the CDP using something similar to `org.seleniumhq.selenium:selenium-devtools-v86:4.16.1` where the version ("v86") matches the version of the chromium-based browser you're using and the version number of the artifact is the same as Selenium's.
Feb 21, 2026 9:27:24 PM org.openqa.selenium.devtools.CdpVersionFinder findNearestMatch
WARNING: Unable to find CDP implementation matching 145
Feb 21, 2026 9:27:24 PM org.openqa.selenium.chromium.ChromiumDriver lambda$new$5
WARNING: Unable to find version of CDP to use for 145.0.7632.76. You may need to include a dependency on a specific version of the CDP using something similar to `org.seleniumhq.selenium:selenium-devtools-v86:4.16.1` where the version ("v86") matches the version of the chromium-based browser you're using and the version number of the artifact is the same as Selenium's.
Feb 21, 2026 9:27:25 PM org.openqa.selenium.devtools.CdpVersionFinder findNearestMatch
WARNING: Unable to find CDP implementation matching 145
Feb 21, 2026 9:27:25 PM org.openqa.selenium.chromium.ChromiumDriver lambda$new$5
WARNING: Unable to find version of CDP to use for 145.0.7632.76. You may need to include a dependency on a specific version of the CDP using something similar to `org.seleniumhq.selenium:selenium-devtools-v86:4.16.1` where the version ("v86") matches the version of the chromium-based browser you're using and the version number of the artifact is the same as Selenium's.
Feb 21, 2026 9:27:27 PM org.openqa.selenium.devtools.CdpVersionFinder findNearestMatch
WARNING: Unable to find CDP implementation matching 145
Feb 21, 2026 9:27:27 PM org.openqa.selenium.chromium.ChromiumDriver lambda$new$5
WARNING: Unable to find version of CDP to use for 145.0.7632.76. You may need to include a dependency on a specific version of the CDP using something similar to `org.seleniumhq.selenium:selenium-devtools-v86:4.16.1` where the version ("v86") matches the version of the chromium-based browser you're using and the version number of the artifact is the same as Selenium's.
Feb 21, 2026 9:27:28 PM org.openqa.selenium.devtools.CdpVersionFinder findNearestMatch
WARNING: Unable to find CDP implementation matching 145
Feb 21, 2026 9:27:28 PM org.openqa.selenium.chromium.ChromiumDriver lambda$new$5
WARNING: Unable to find version of CDP to use for 145.0.7632.76. You may need to include a dependency on a specific version of the CDP using something similar to `org.seleniumhq.selenium:selenium-devtools-v86:4.16.1` where the version ("v86") matches the version of the chromium-based browser you're using and the version number of the artifact is the same as Selenium's.
Feb 21, 2026 9:27:30 PM org.openqa.selenium.devtools.CdpVersionFinder findNearestMatch
WARNING: Unable to find CDP implementation matching 145
Feb 21, 2026 9:27:30 PM org.openqa.selenium.chromium.ChromiumDriver lambda$new$5
WARNING: Unable to find version of CDP to use for 145.0.7632.76. You may need to include a dependency on a specific version of the CDP using something similar to `org.seleniumhq.selenium:selenium-devtools-v86:4.16.1` where the version ("v86") matches the version of the chromium-based browser you're using and the version number of the artifact is the same as Selenium's.
Feb 21, 2026 9:27:31 PM org.openqa.selenium.devtools.CdpVersionFinder findNearestMatch
WARNING: Unable to find CDP implementation matching 145
Feb 21, 2026 9:27:31 PM org.openqa.selenium.chromium.ChromiumDriver lambda$new$5
WARNING: Unable to find version of CDP to use for 145.0.7632.76. You may need to include a dependency on a specific version of the CDP using something similar to `org.seleniumhq.selenium:selenium-devtools-v86:4.16.1` where the version ("v86") matches the version of the chromium-based browser you're using and the version number of the artifact is the same as Selenium's.
Feb 21, 2026 9:27:33 PM org.openqa.selenium.devtools.CdpVersionFinder findNearestMatch
WARNING: Unable to find CDP implementation matching 145
Feb 21, 2026 9:27:33 PM org.openqa.selenium.chromium.ChromiumDriver lambda$new$5
WARNING: Unable to find version of CDP to use for 145.0.7632.76. You may need to include a dependency on a specific version of the CDP using something similar to `org.seleniumhq.selenium:selenium-devtools-v86:4.16.1` where the version ("v86") matches the version of the chromium-based browser you're using and the version number of the artifact is the same as Selenium's.
Feb 21, 2026 9:27:34 PM org.openqa.selenium.devtools.CdpVersionFinder findNearestMatch
WARNING: Unable to find CDP implementation matching 145
Feb 21, 2026 9:27:34 PM org.openqa.selenium.chromium.ChromiumDriver lambda$new$5
WARNING: Unable to find version of CDP to use for 145.0.7632.76. You may need to include a dependency on a specific version of the CDP using something similar to `org.seleniumhq.selenium:selenium-devtools-v86:4.16.1` where the version ("v86") matches the version of the chromium-based browser you're using and the version number of the artifact is the same as Selenium's.
Feb 21, 2026 9:27:35 PM org.openqa.selenium.devtools.CdpVersionFinder findNearestMatch
WARNING: Unable to find CDP implementation matching 145
Feb 21, 2026 9:27:35 PM org.openqa.selenium.chromium.ChromiumDriver lambda$new$5
WARNING: Unable to find version of CDP to use for 145.0.7632.76. You may need to include a dependency on a specific version of the CDP using something similar to `org.seleniumhq.selenium:selenium-devtools-v86:4.16.1` where the version ("v86") matches the version of the chromium-based browser you're using and the version number of the artifact is the same as Selenium's.
Feb 21, 2026 9:27:37 PM org.openqa.selenium.devtools.CdpVersionFinder findNearestMatch
WARNING: Unable to find CDP implementation matching 145
Feb 21, 2026 9:27:37 PM org.openqa.selenium.chromium.ChromiumDriver lambda$new$5
WARNING: Unable to find version of CDP to use for 145.0.7632.76. You may need to include a dependency on a specific version of the CDP using something similar to `org.seleniumhq.selenium:selenium-devtools-v86:4.16.1` where the version ("v86") matches the version of the chromium-based browser you're using and the version number of the artifact is the same as Selenium's.
Feb 21, 2026 9:27:38 PM org.openqa.selenium.devtools.CdpVersionFinder findNearestMatch
WARNING: Unable to find CDP implementation matching 145
Feb 21, 2026 9:27:38 PM org.openqa.selenium.chromium.ChromiumDriver lambda$new$5
WARNING: Unable to find version of CDP to use for 145.0.7632.76. You may need to include a dependency on a specific version of the CDP using something similar to `org.seleniumhq.selenium:selenium-devtools-v86:4.16.1` where the version ("v86") matches the version of the chromium-based browser you're using and the version number of the artifact is the same as Selenium's.
Feb 21, 2026 9:27:39 PM org.openqa.selenium.devtools.CdpVersionFinder findNearestMatch
WARNING: Unable to find CDP implementation matching 145
Feb 21, 2026 9:27:39 PM org.openqa.selenium.chromium.ChromiumDriver lambda$new$5
WARNING: Unable to find version of CDP to use for 145.0.7632.76. You may need to include a dependency on a specific version of the CDP using something similar to `org.seleniumhq.selenium:selenium-devtools-v86:4.16.1` where the version ("v86") matches the version of the chromium-based browser you're using and the version number of the artifact is the same as Selenium's.
Feb 21, 2026 9:27:41 PM org.openqa.selenium.devtools.CdpVersionFinder findNearestMatch
WARNING: Unable to find CDP implementation matching 145
Feb 21, 2026 9:27:41 PM org.openqa.selenium.chromium.ChromiumDriver lambda$new$5
WARNING: Unable to find version of CDP to use for 145.0.7632.76. You may need to include a dependency on a specific version of the CDP using something similar to `org.seleniumhq.selenium:selenium-devtools-v86:4.16.1` where the version ("v86") matches the version of the chromium-based browser you're using and the version number of the artifact is the same as Selenium's.
Feb 21, 2026 9:27:42 PM org.openqa.selenium.devtools.CdpVersionFinder findNearestMatch
WARNING: Unable to find CDP implementation matching 145
Feb 21, 2026 9:27:42 PM org.openqa.selenium.chromium.ChromiumDriver lambda$new$5
WARNING: Unable to find version of CDP to use for 145.0.7632.76. You may need to include a dependency on a specific version of the CDP using something similar to `org.seleniumhq.selenium:selenium-devtools-v86:4.16.1` where the version ("v86") matches the version of the chromium-based browser you're using and the version number of the artifact is the same as Selenium's.
Database connection closed.
[ERROR] Tests run: 19, Failures: 10, Errors: 0, Skipped: 0, Time elapsed: 27.30 s <<< FAILURE! -- in TestSuite
[ERROR] com.logintest.LoginTest.testCorrectEmailWrongPassword -- Time elapsed: 0.221 s <<< FAILURE!
java.lang.AssertionError: expected [true] but found [false]
	at org.testng.Assert.fail(Assert.java:111)
	at org.testng.Assert.failNotEquals(Assert.java:1578)
	at org.testng.Assert.assertTrue(Assert.java:57)
	at org.testng.Assert.assertTrue(Assert.java:67)
	at com.logintest.LoginTest.assertStatusContains(LoginTest.java:275)
	at com.logintest.LoginTest.testCorrectEmailWrongPassword(LoginTest.java:80)
	at java.base/jdk.internal.reflect.DirectMethodHandleAccessor.invoke(DirectMethodHandleAccessor.java:103)
	at java.base/java.lang.reflect.Method.invoke(Method.java:580)
	at org.testng.internal.invokers.MethodInvocationHelper.invokeMethod(MethodInvocationHelper.java:139)
	at org.testng.internal.invokers.TestInvoker.invokeMethod(TestInvoker.java:664)
	at org.testng.internal.invokers.TestInvoker.invokeTestMethod(TestInvoker.java:228)
	at org.testng.internal.invokers.MethodRunner.runInSequence(MethodRunner.java:63)
	at org.testng.internal.invokers.TestInvoker$MethodInvocationAgent.invoke(TestInvoker.java:961)
	at org.testng.internal.invokers.TestInvoker.invokeTestMethods(TestInvoker.java:201)
	at org.testng.internal.invokers.TestMethodWorker.invokeTestMethods(TestMethodWorker.java:148)
	at org.testng.internal.invokers.TestMethodWorker.run(TestMethodWorker.java:128)
	at java.base/java.util.ArrayList.forEach(ArrayList.java:1596)
	at org.testng.TestRunner.privateRun(TestRunner.java:819)
	at org.testng.TestRunner.run(TestRunner.java:619)
	at org.testng.SuiteRunner.runTest(SuiteRunner.java:443)
	at org.testng.SuiteRunner.runSequentially(SuiteRunner.java:437)
	at org.testng.SuiteRunner.privateRun(SuiteRunner.java:397)
	at org.testng.SuiteRunner.run(SuiteRunner.java:336)
	at org.testng.SuiteRunnerWorker.runSuite(SuiteRunnerWorker.java:52)
	at org.testng.SuiteRunnerWorker.run(SuiteRunnerWorker.java:95)
	at org.testng.TestNG.runSuitesSequentially(TestNG.java:1301)
	at org.testng.TestNG.runSuitesLocally(TestNG.java:1228)
	at org.testng.TestNG.runSuites(TestNG.java:1134)
	at org.testng.TestNG.run(TestNG.java:1101)
	at org.apache.maven.surefire.testng.TestNGExecutor.run(TestNGExecutor.java:155)
	at org.apache.maven.surefire.testng.TestNGDirectoryTestSuite.executeMulti(TestNGDirectoryTestSuite.java:169)
	at org.apache.maven.surefire.testng.TestNGDirectoryTestSuite.execute(TestNGDirectoryTestSuite.java:88)
	at org.apache.maven.surefire.testng.TestNGProvider.invoke(TestNGProvider.java:137)
	at org.apache.maven.surefire.booter.ForkedBooter.runSuitesInProcess(ForkedBooter.java:385)
	at org.apache.maven.surefire.booter.ForkedBooter.execute(ForkedBooter.java:162)
	at org.apache.maven.surefire.booter.ForkedBooter.run(ForkedBooter.java:507)
	at org.apache.maven.surefire.booter.ForkedBooter.main(ForkedBooter.java:495)

[ERROR] com.logintest.LoginTest.testEnterKeySubmission -- Time elapsed: 0.124 s <<< FAILURE!
java.lang.AssertionError: expected [true] but found [false]
	at org.testng.Assert.fail(Assert.java:111)
	at org.testng.Assert.failNotEquals(Assert.java:1578)
	at org.testng.Assert.assertTrue(Assert.java:57)
	at org.testng.Assert.assertTrue(Assert.java:67)
	at com.logintest.LoginTest.assertStatusContains(LoginTest.java:275)
	at com.logintest.LoginTest.testEnterKeySubmission(LoginTest.java:219)
	at java.base/jdk.internal.reflect.DirectMethodHandleAccessor.invoke(DirectMethodHandleAccessor.java:103)
	at java.base/java.lang.reflect.Method.invoke(Method.java:580)
	at org.testng.internal.invokers.MethodInvocationHelper.invokeMethod(MethodInvocationHelper.java:139)
	at org.testng.internal.invokers.TestInvoker.invokeMethod(TestInvoker.java:664)
	at org.testng.internal.invokers.TestInvoker.invokeTestMethod(TestInvoker.java:228)
	at org.testng.internal.invokers.MethodRunner.runInSequence(MethodRunner.java:63)
	at org.testng.internal.invokers.TestInvoker$MethodInvocationAgent.invoke(TestInvoker.java:961)
	at org.testng.internal.invokers.TestInvoker.invokeTestMethods(TestInvoker.java:201)
	at org.testng.internal.invokers.TestMethodWorker.invokeTestMethods(TestMethodWorker.java:148)
	at org.testng.internal.invokers.TestMethodWorker.run(TestMethodWorker.java:128)
	at java.base/java.util.ArrayList.forEach(ArrayList.java:1596)
	at org.testng.TestRunner.privateRun(TestRunner.java:819)
	at org.testng.TestRunner.run(TestRunner.java:619)
	at org.testng.SuiteRunner.runTest(SuiteRunner.java:443)
	at org.testng.SuiteRunner.runSequentially(SuiteRunner.java:437)
	at org.testng.SuiteRunner.privateRun(SuiteRunner.java:397)
	at org.testng.SuiteRunner.run(SuiteRunner.java:336)
	at org.testng.SuiteRunnerWorker.runSuite(SuiteRunnerWorker.java:52)
	at org.testng.SuiteRunnerWorker.run(SuiteRunnerWorker.java:95)
	at org.testng.TestNG.runSuitesSequentially(TestNG.java:1301)
	at org.testng.TestNG.runSuitesLocally(TestNG.java:1228)
	at org.testng.TestNG.runSuites(TestNG.java:1134)
	at org.testng.TestNG.run(TestNG.java:1101)
	at org.apache.maven.surefire.testng.TestNGExecutor.run(TestNGExecutor.java:155)
	at org.apache.maven.surefire.testng.TestNGDirectoryTestSuite.executeMulti(TestNGDirectoryTestSuite.java:169)
	at org.apache.maven.surefire.testng.TestNGDirectoryTestSuite.execute(TestNGDirectoryTestSuite.java:88)
	at org.apache.maven.surefire.testng.TestNGProvider.invoke(TestNGProvider.java:137)
	at org.apache.maven.surefire.booter.ForkedBooter.runSuitesInProcess(ForkedBooter.java:385)
	at org.apache.maven.surefire.booter.ForkedBooter.execute(ForkedBooter.java:162)
	at org.apache.maven.surefire.booter.ForkedBooter.run(ForkedBooter.java:507)
	at org.apache.maven.surefire.booter.ForkedBooter.main(ForkedBooter.java:495)

[ERROR] com.logintest.LoginTest.testHTMLInjection -- Time elapsed: 0.152 s <<< FAILURE!
java.lang.AssertionError: expected [true] but found [false]
	at org.testng.Assert.fail(Assert.java:111)
	at org.testng.Assert.failNotEquals(Assert.java:1578)
	at org.testng.Assert.assertTrue(Assert.java:57)
	at org.testng.Assert.assertTrue(Assert.java:67)
	at com.logintest.LoginTest.assertStatusContains(LoginTest.java:275)
	at com.logintest.LoginTest.testHTMLInjection(LoginTest.java:161)
	at java.base/jdk.internal.reflect.DirectMethodHandleAccessor.invoke(DirectMethodHandleAccessor.java:103)
	at java.base/java.lang.reflect.Method.invoke(Method.java:580)
	at org.testng.internal.invokers.MethodInvocationHelper.invokeMethod(MethodInvocationHelper.java:139)
	at org.testng.internal.invokers.TestInvoker.invokeMethod(TestInvoker.java:664)
	at org.testng.internal.invokers.TestInvoker.invokeTestMethod(TestInvoker.java:228)
	at org.testng.internal.invokers.MethodRunner.runInSequence(MethodRunner.java:63)
	at org.testng.internal.invokers.TestInvoker$MethodInvocationAgent.invoke(TestInvoker.java:961)
	at org.testng.internal.invokers.TestInvoker.invokeTestMethods(TestInvoker.java:201)
	at org.testng.internal.invokers.TestMethodWorker.invokeTestMethods(TestMethodWorker.java:148)
	at org.testng.internal.invokers.TestMethodWorker.run(TestMethodWorker.java:128)
	at java.base/java.util.ArrayList.forEach(ArrayList.java:1596)
	at org.testng.TestRunner.privateRun(TestRunner.java:819)
	at org.testng.TestRunner.run(TestRunner.java:619)
	at org.testng.SuiteRunner.runTest(SuiteRunner.java:443)
	at org.testng.SuiteRunner.runSequentially(SuiteRunner.java:437)
	at org.testng.SuiteRunner.privateRun(SuiteRunner.java:397)
	at org.testng.SuiteRunner.run(SuiteRunner.java:336)
	at org.testng.SuiteRunnerWorker.runSuite(SuiteRunnerWorker.java:52)
	at org.testng.SuiteRunnerWorker.run(SuiteRunnerWorker.java:95)
	at org.testng.TestNG.runSuitesSequentially(TestNG.java:1301)
	at org.testng.TestNG.runSuitesLocally(TestNG.java:1228)
	at org.testng.TestNG.runSuites(TestNG.java:1134)
	at org.testng.TestNG.run(TestNG.java:1101)
	at org.apache.maven.surefire.testng.TestNGExecutor.run(TestNGExecutor.java:155)
	at org.apache.maven.surefire.testng.TestNGDirectoryTestSuite.executeMulti(TestNGDirectoryTestSuite.java:169)
	at org.apache.maven.surefire.testng.TestNGDirectoryTestSuite.execute(TestNGDirectoryTestSuite.java:88)
	at org.apache.maven.surefire.testng.TestNGProvider.invoke(TestNGProvider.java:137)
	at org.apache.maven.surefire.booter.ForkedBooter.runSuitesInProcess(ForkedBooter.java:385)
	at org.apache.maven.surefire.booter.ForkedBooter.execute(ForkedBooter.java:162)
	at org.apache.maven.surefire.booter.ForkedBooter.run(ForkedBooter.java:507)
	at org.apache.maven.surefire.booter.ForkedBooter.main(ForkedBooter.java:495)

[ERROR] com.logintest.LoginTest.testInvalidLogin -- Time elapsed: 0.670 s <<< FAILURE!
java.lang.AssertionError: expected [true] but found [false]
	at org.testng.Assert.fail(Assert.java:111)
	at org.testng.Assert.failNotEquals(Assert.java:1578)
	at org.testng.Assert.assertTrue(Assert.java:57)
	at org.testng.Assert.assertTrue(Assert.java:67)
	at com.logintest.LoginTest.assertStatusContains(LoginTest.java:275)
	at com.logintest.LoginTest.testInvalidLogin(LoginTest.java:74)
	at java.base/jdk.internal.reflect.DirectMethodHandleAccessor.invoke(DirectMethodHandleAccessor.java:103)
	at java.base/java.lang.reflect.Method.invoke(Method.java:580)
	at org.testng.internal.invokers.MethodInvocationHelper.invokeMethod(MethodInvocationHelper.java:139)
	at org.testng.internal.invokers.TestInvoker.invokeMethod(TestInvoker.java:664)
	at org.testng.internal.invokers.TestInvoker.invokeTestMethod(TestInvoker.java:228)
	at org.testng.internal.invokers.MethodRunner.runInSequence(MethodRunner.java:63)
	at org.testng.internal.invokers.TestInvoker$MethodInvocationAgent.invoke(TestInvoker.java:961)
	at org.testng.internal.invokers.TestInvoker.invokeTestMethods(TestInvoker.java:201)
	at org.testng.internal.invokers.TestMethodWorker.invokeTestMethods(TestMethodWorker.java:148)
	at org.testng.internal.invokers.TestMethodWorker.run(TestMethodWorker.java:128)
	at java.base/java.util.ArrayList.forEach(ArrayList.java:1596)
	at org.testng.TestRunner.privateRun(TestRunner.java:819)
	at org.testng.TestRunner.run(TestRunner.java:619)
	at org.testng.SuiteRunner.runTest(SuiteRunner.java:443)
	at org.testng.SuiteRunner.runSequentially(SuiteRunner.java:437)
	at org.testng.SuiteRunner.privateRun(SuiteRunner.java:397)
	at org.testng.SuiteRunner.run(SuiteRunner.java:336)
	at org.testng.SuiteRunnerWorker.runSuite(SuiteRunnerWorker.java:52)
	at org.testng.SuiteRunnerWorker.run(SuiteRunnerWorker.java:95)
	at org.testng.TestNG.runSuitesSequentially(TestNG.java:1301)
	at org.testng.TestNG.runSuitesLocally(TestNG.java:1228)
	at org.testng.TestNG.runSuites(TestNG.java:1134)
	at org.testng.TestNG.run(TestNG.java:1101)
	at org.apache.maven.surefire.testng.TestNGExecutor.run(TestNGExecutor.java:155)
	at org.apache.maven.surefire.testng.TestNGDirectoryTestSuite.executeMulti(TestNGDirectoryTestSuite.java:169)
	at org.apache.maven.surefire.testng.TestNGDirectoryTestSuite.execute(TestNGDirectoryTestSuite.java:88)
	at org.apache.maven.surefire.testng.TestNGProvider.invoke(TestNGProvider.java:137)
	at org.apache.maven.surefire.booter.ForkedBooter.runSuitesInProcess(ForkedBooter.java:385)
	at org.apache.maven.surefire.booter.ForkedBooter.execute(ForkedBooter.java:162)
	at org.apache.maven.surefire.booter.ForkedBooter.run(ForkedBooter.java:507)
	at org.apache.maven.surefire.booter.ForkedBooter.main(ForkedBooter.java:495)

[ERROR] com.logintest.LoginTest.testLeadingTrailingSpaces -- Time elapsed: 0.155 s <<< FAILURE!
java.lang.AssertionError: expected [true] but found [false]
	at org.testng.Assert.fail(Assert.java:111)
	at org.testng.Assert.failNotEquals(Assert.java:1578)
	at org.testng.Assert.assertTrue(Assert.java:57)
	at org.testng.Assert.assertTrue(Assert.java:67)
	at com.logintest.LoginTest.assertStatusContains(LoginTest.java:275)
	at com.logintest.LoginTest.testLeadingTrailingSpaces(LoginTest.java:133)
	at java.base/jdk.internal.reflect.DirectMethodHandleAccessor.invoke(DirectMethodHandleAccessor.java:103)
	at java.base/java.lang.reflect.Method.invoke(Method.java:580)
	at org.testng.internal.invokers.MethodInvocationHelper.invokeMethod(MethodInvocationHelper.java:139)
	at org.testng.internal.invokers.TestInvoker.invokeMethod(TestInvoker.java:664)
	at org.testng.internal.invokers.TestInvoker.invokeTestMethod(TestInvoker.java:228)
	at org.testng.internal.invokers.MethodRunner.runInSequence(MethodRunner.java:63)
	at org.testng.internal.invokers.TestInvoker$MethodInvocationAgent.invoke(TestInvoker.java:961)
	at org.testng.internal.invokers.TestInvoker.invokeTestMethods(TestInvoker.java:201)
	at org.testng.internal.invokers.TestMethodWorker.invokeTestMethods(TestMethodWorker.java:148)
	at org.testng.internal.invokers.TestMethodWorker.run(TestMethodWorker.java:128)
	at java.base/java.util.ArrayList.forEach(ArrayList.java:1596)
	at org.testng.TestRunner.privateRun(TestRunner.java:819)
	at org.testng.TestRunner.run(TestRunner.java:619)
	at org.testng.SuiteRunner.runTest(SuiteRunner.java:443)
	at org.testng.SuiteRunner.runSequentially(SuiteRunner.java:437)
	at org.testng.SuiteRunner.privateRun(SuiteRunner.java:397)
	at org.testng.SuiteRunner.run(SuiteRunner.java:336)
	at org.testng.SuiteRunnerWorker.runSuite(SuiteRunnerWorker.java:52)
	at org.testng.SuiteRunnerWorker.run(SuiteRunnerWorker.java:95)
	at org.testng.TestNG.runSuitesSequentially(TestNG.java:1301)
	at org.testng.TestNG.runSuitesLocally(TestNG.java:1228)
	at org.testng.TestNG.runSuites(TestNG.java:1134)
	at org.testng.TestNG.run(TestNG.java:1101)
	at org.apache.maven.surefire.testng.TestNGExecutor.run(TestNGExecutor.java:155)
	at org.apache.maven.surefire.testng.TestNGDirectoryTestSuite.executeMulti(TestNGDirectoryTestSuite.java:169)
	at org.apache.maven.surefire.testng.TestNGDirectoryTestSuite.execute(TestNGDirectoryTestSuite.java:88)
	at org.apache.maven.surefire.testng.TestNGProvider.invoke(TestNGProvider.java:137)
	at org.apache.maven.surefire.booter.ForkedBooter.runSuitesInProcess(ForkedBooter.java:385)
	at org.apache.maven.surefire.booter.ForkedBooter.execute(ForkedBooter.java:162)
	at org.apache.maven.surefire.booter.ForkedBooter.run(ForkedBooter.java:507)
	at org.apache.maven.surefire.booter.ForkedBooter.main(ForkedBooter.java:495)

[ERROR] com.logintest.LoginTest.testRegistrationSuccess -- Time elapsed: 0.222 s <<< FAILURE!
java.lang.AssertionError: expected [true] but found [false]
	at org.testng.Assert.fail(Assert.java:111)
	at org.testng.Assert.failNotEquals(Assert.java:1578)
	at org.testng.Assert.assertTrue(Assert.java:57)
	at org.testng.Assert.assertTrue(Assert.java:67)
	at com.logintest.LoginTest.assertStatusContains(LoginTest.java:275)
	at com.logintest.LoginTest.testRegistrationSuccess(LoginTest.java:178)
	at java.base/jdk.internal.reflect.DirectMethodHandleAccessor.invoke(DirectMethodHandleAccessor.java:103)
	at java.base/java.lang.reflect.Method.invoke(Method.java:580)
	at org.testng.internal.invokers.MethodInvocationHelper.invokeMethod(MethodInvocationHelper.java:139)
	at org.testng.internal.invokers.TestInvoker.invokeMethod(TestInvoker.java:664)
	at org.testng.internal.invokers.TestInvoker.invokeTestMethod(TestInvoker.java:228)
	at org.testng.internal.invokers.MethodRunner.runInSequence(MethodRunner.java:63)
	at org.testng.internal.invokers.TestInvoker$MethodInvocationAgent.invoke(TestInvoker.java:961)
	at org.testng.internal.invokers.TestInvoker.invokeTestMethods(TestInvoker.java:201)
	at org.testng.internal.invokers.TestMethodWorker.invokeTestMethods(TestMethodWorker.java:148)
	at org.testng.internal.invokers.TestMethodWorker.run(TestMethodWorker.java:128)
	at java.base/java.util.ArrayList.forEach(ArrayList.java:1596)
	at org.testng.TestRunner.privateRun(TestRunner.java:819)
	at org.testng.TestRunner.run(TestRunner.java:619)
	at org.testng.SuiteRunner.runTest(SuiteRunner.java:443)
	at org.testng.SuiteRunner.runSequentially(SuiteRunner.java:437)
	at org.testng.SuiteRunner.privateRun(SuiteRunner.java:397)
	at org.testng.SuiteRunner.run(SuiteRunner.java:336)
	at org.testng.SuiteRunnerWorker.runSuite(SuiteRunnerWorker.java:52)
	at org.testng.SuiteRunnerWorker.run(SuiteRunnerWorker.java:95)
	at org.testng.TestNG.runSuitesSequentially(TestNG.java:1301)
	at org.testng.TestNG.runSuitesLocally(TestNG.java:1228)
	at org.testng.TestNG.runSuites(TestNG.java:1134)
	at org.testng.TestNG.run(TestNG.java:1101)
	at org.apache.maven.surefire.testng.TestNGExecutor.run(TestNGExecutor.java:155)
	at org.apache.maven.surefire.testng.TestNGDirectoryTestSuite.executeMulti(TestNGDirectoryTestSuite.java:169)
	at org.apache.maven.surefire.testng.TestNGDirectoryTestSuite.execute(TestNGDirectoryTestSuite.java:88)
	at org.apache.maven.surefire.testng.TestNGProvider.invoke(TestNGProvider.java:137)
	at org.apache.maven.surefire.booter.ForkedBooter.runSuitesInProcess(ForkedBooter.java:385)
	at org.apache.maven.surefire.booter.ForkedBooter.execute(ForkedBooter.java:162)
	at org.apache.maven.surefire.booter.ForkedBooter.run(ForkedBooter.java:507)
	at org.apache.maven.surefire.booter.ForkedBooter.main(ForkedBooter.java:495)

[ERROR] com.logintest.LoginTest.testSQLInjection -- Time elapsed: 0.147 s <<< FAILURE!
java.lang.AssertionError: expected [true] but found [false]
	at org.testng.Assert.fail(Assert.java:111)
	at org.testng.Assert.failNotEquals(Assert.java:1578)
	at org.testng.Assert.assertTrue(Assert.java:57)
	at org.testng.Assert.assertTrue(Assert.java:67)
	at com.logintest.LoginTest.assertStatusContains(LoginTest.java:275)
	at com.logintest.LoginTest.testSQLInjection(LoginTest.java:149)
	at java.base/jdk.internal.reflect.DirectMethodHandleAccessor.invoke(DirectMethodHandleAccessor.java:103)
	at java.base/java.lang.reflect.Method.invoke(Method.java:580)
	at org.testng.internal.invokers.MethodInvocationHelper.invokeMethod(MethodInvocationHelper.java:139)
	at org.testng.internal.invokers.TestInvoker.invokeMethod(TestInvoker.java:664)
	at org.testng.internal.invokers.TestInvoker.invokeTestMethod(TestInvoker.java:228)
	at org.testng.internal.invokers.MethodRunner.runInSequence(MethodRunner.java:63)
	at org.testng.internal.invokers.TestInvoker$MethodInvocationAgent.invoke(TestInvoker.java:961)
	at org.testng.internal.invokers.TestInvoker.invokeTestMethods(TestInvoker.java:201)
	at org.testng.internal.invokers.TestMethodWorker.invokeTestMethods(TestMethodWorker.java:148)
	at org.testng.internal.invokers.TestMethodWorker.run(TestMethodWorker.java:128)
	at java.base/java.util.ArrayList.forEach(ArrayList.java:1596)
	at org.testng.TestRunner.privateRun(TestRunner.java:819)
	at org.testng.TestRunner.run(TestRunner.java:619)
	at org.testng.SuiteRunner.runTest(SuiteRunner.java:443)
	at org.testng.SuiteRunner.runSequentially(SuiteRunner.java:437)
	at org.testng.SuiteRunner.privateRun(SuiteRunner.java:397)
	at org.testng.SuiteRunner.run(SuiteRunner.java:336)
	at org.testng.SuiteRunnerWorker.runSuite(SuiteRunnerWorker.java:52)
	at org.testng.SuiteRunnerWorker.run(SuiteRunnerWorker.java:95)
	at org.testng.TestNG.runSuitesSequentially(TestNG.java:1301)
	at org.testng.TestNG.runSuitesLocally(TestNG.java:1228)
	at org.testng.TestNG.runSuites(TestNG.java:1134)
	at org.testng.TestNG.run(TestNG.java:1101)
	at org.apache.maven.surefire.testng.TestNGExecutor.run(TestNGExecutor.java:155)
	at org.apache.maven.surefire.testng.TestNGDirectoryTestSuite.executeMulti(TestNGDirectoryTestSuite.java:169)
	at org.apache.maven.surefire.testng.TestNGDirectoryTestSuite.execute(TestNGDirectoryTestSuite.java:88)
	at org.apache.maven.surefire.testng.TestNGProvider.invoke(TestNGProvider.java:137)
	at org.apache.maven.surefire.booter.ForkedBooter.runSuitesInProcess(ForkedBooter.java:385)
	at org.apache.maven.surefire.booter.ForkedBooter.execute(ForkedBooter.java:162)
	at org.apache.maven.surefire.booter.ForkedBooter.run(ForkedBooter.java:507)
	at org.apache.maven.surefire.booter.ForkedBooter.main(ForkedBooter.java:495)

[ERROR] com.logintest.LoginTest.testUnicodeCharacters -- Time elapsed: 0.157 s <<< FAILURE!
java.lang.AssertionError: expected [true] but found [false]
	at org.testng.Assert.fail(Assert.java:111)
	at org.testng.Assert.failNotEquals(Assert.java:1578)
	at org.testng.Assert.assertTrue(Assert.java:57)
	at org.testng.Assert.assertTrue(Assert.java:67)
	at com.logintest.LoginTest.assertStatusContains(LoginTest.java:275)
	at com.logintest.LoginTest.testUnicodeCharacters(LoginTest.java:139)
	at java.base/jdk.internal.reflect.DirectMethodHandleAccessor.invoke(DirectMethodHandleAccessor.java:103)
	at java.base/java.lang.reflect.Method.invoke(Method.java:580)
	at org.testng.internal.invokers.MethodInvocationHelper.invokeMethod(MethodInvocationHelper.java:139)
	at org.testng.internal.invokers.TestInvoker.invokeMethod(TestInvoker.java:664)
	at org.testng.internal.invokers.TestInvoker.invokeTestMethod(TestInvoker.java:228)
	at org.testng.internal.invokers.MethodRunner.runInSequence(MethodRunner.java:63)
	at org.testng.internal.invokers.TestInvoker$MethodInvocationAgent.invoke(TestInvoker.java:961)
	at org.testng.internal.invokers.TestInvoker.invokeTestMethods(TestInvoker.java:201)
	at org.testng.internal.invokers.TestMethodWorker.invokeTestMethods(TestMethodWorker.java:148)
	at org.testng.internal.invokers.TestMethodWorker.run(TestMethodWorker.java:128)
	at java.base/java.util.ArrayList.forEach(ArrayList.java:1596)
	at org.testng.TestRunner.privateRun(TestRunner.java:819)
	at org.testng.TestRunner.run(TestRunner.java:619)
	at org.testng.SuiteRunner.runTest(SuiteRunner.java:443)
	at org.testng.SuiteRunner.runSequentially(SuiteRunner.java:437)
	at org.testng.SuiteRunner.privateRun(SuiteRunner.java:397)
	at org.testng.SuiteRunner.run(SuiteRunner.java:336)
	at org.testng.SuiteRunnerWorker.runSuite(SuiteRunnerWorker.java:52)
	at org.testng.SuiteRunnerWorker.run(SuiteRunnerWorker.java:95)
	at org.testng.TestNG.runSuitesSequentially(TestNG.java:1301)
	at org.testng.TestNG.runSuitesLocally(TestNG.java:1228)
	at org.testng.TestNG.runSuites(TestNG.java:1134)
	at org.testng.TestNG.run(TestNG.java:1101)
	at org.apache.maven.surefire.testng.TestNGExecutor.run(TestNGExecutor.java:155)
	at org.apache.maven.surefire.testng.TestNGDirectoryTestSuite.executeMulti(TestNGDirectoryTestSuite.java:169)
	at org.apache.maven.surefire.testng.TestNGDirectoryTestSuite.execute(TestNGDirectoryTestSuite.java:88)
	at org.apache.maven.surefire.testng.TestNGProvider.invoke(TestNGProvider.java:137)
	at org.apache.maven.surefire.booter.ForkedBooter.runSuitesInProcess(ForkedBooter.java:385)
	at org.apache.maven.surefire.booter.ForkedBooter.execute(ForkedBooter.java:162)
	at org.apache.maven.surefire.booter.ForkedBooter.run(ForkedBooter.java:507)
	at org.apache.maven.surefire.booter.ForkedBooter.main(ForkedBooter.java:495)

[ERROR] com.logintest.LoginTest.testValidLogin -- Time elapsed: 0.155 s <<< FAILURE!
java.lang.AssertionError: expected [true] but found [false]
	at org.testng.Assert.fail(Assert.java:111)
	at org.testng.Assert.failNotEquals(Assert.java:1578)
	at org.testng.Assert.assertTrue(Assert.java:57)
	at org.testng.Assert.assertTrue(Assert.java:67)
	at com.logintest.LoginTest.assertStatusContains(LoginTest.java:275)
	at com.logintest.LoginTest.testValidLogin(LoginTest.java:68)
	at java.base/jdk.internal.reflect.DirectMethodHandleAccessor.invoke(DirectMethodHandleAccessor.java:103)
	at java.base/java.lang.reflect.Method.invoke(Method.java:580)
	at org.testng.internal.invokers.MethodInvocationHelper.invokeMethod(MethodInvocationHelper.java:139)
	at org.testng.internal.invokers.TestInvoker.invokeMethod(TestInvoker.java:664)
	at org.testng.internal.invokers.TestInvoker.invokeTestMethod(TestInvoker.java:228)
	at org.testng.internal.invokers.MethodRunner.runInSequence(MethodRunner.java:63)
	at org.testng.internal.invokers.TestInvoker$MethodInvocationAgent.invoke(TestInvoker.java:961)
	at org.testng.internal.invokers.TestInvoker.invokeTestMethods(TestInvoker.java:201)
	at org.testng.internal.invokers.TestMethodWorker.invokeTestMethods(TestMethodWorker.java:148)
	at org.testng.internal.invokers.TestMethodWorker.run(TestMethodWorker.java:128)
	at java.base/java.util.ArrayList.forEach(ArrayList.java:1596)
	at org.testng.TestRunner.privateRun(TestRunner.java:819)
	at org.testng.TestRunner.run(TestRunner.java:619)
	at org.testng.SuiteRunner.runTest(SuiteRunner.java:443)
	at org.testng.SuiteRunner.runSequentially(SuiteRunner.java:437)
	at org.testng.SuiteRunner.privateRun(SuiteRunner.java:397)
	at org.testng.SuiteRunner.run(SuiteRunner.java:336)
	at org.testng.SuiteRunnerWorker.runSuite(SuiteRunnerWorker.java:52)
	at org.testng.SuiteRunnerWorker.run(SuiteRunnerWorker.java:95)
	at org.testng.TestNG.runSuitesSequentially(TestNG.java:1301)
	at org.testng.TestNG.runSuitesLocally(TestNG.java:1228)
	at org.testng.TestNG.runSuites(TestNG.java:1134)
	at org.testng.TestNG.run(TestNG.java:1101)
	at org.apache.maven.surefire.testng.TestNGExecutor.run(TestNGExecutor.java:155)
	at org.apache.maven.surefire.testng.TestNGDirectoryTestSuite.executeMulti(TestNGDirectoryTestSuite.java:169)
	at org.apache.maven.surefire.testng.TestNGDirectoryTestSuite.execute(TestNGDirectoryTestSuite.java:88)
	at org.apache.maven.surefire.testng.TestNGProvider.invoke(TestNGProvider.java:137)
	at org.apache.maven.surefire.booter.ForkedBooter.runSuitesInProcess(ForkedBooter.java:385)
	at org.apache.maven.surefire.booter.ForkedBooter.execute(ForkedBooter.java:162)
	at org.apache.maven.surefire.booter.ForkedBooter.run(ForkedBooter.java:507)
	at org.apache.maven.surefire.booter.ForkedBooter.main(ForkedBooter.java:495)

[ERROR] com.logintest.LoginTest.testXSSInjection -- Time elapsed: 0.155 s <<< FAILURE!
java.lang.AssertionError: expected [true] but found [false]
	at org.testng.Assert.fail(Assert.java:111)
	at org.testng.Assert.failNotEquals(Assert.java:1578)
	at org.testng.Assert.assertTrue(Assert.java:57)
	at org.testng.Assert.assertTrue(Assert.java:67)
	at com.logintest.LoginTest.assertStatusContains(LoginTest.java:275)
	at com.logintest.LoginTest.testXSSInjection(LoginTest.java:155)
	at java.base/jdk.internal.reflect.DirectMethodHandleAccessor.invoke(DirectMethodHandleAccessor.java:103)
	at java.base/java.lang.reflect.Method.invoke(Method.java:580)
	at org.testng.internal.invokers.MethodInvocationHelper.invokeMethod(MethodInvocationHelper.java:139)
	at org.testng.internal.invokers.TestInvoker.invokeMethod(TestInvoker.java:664)
	at org.testng.internal.invokers.TestInvoker.invokeTestMethod(TestInvoker.java:228)
	at org.testng.internal.invokers.MethodRunner.runInSequence(MethodRunner.java:63)
	at org.testng.internal.invokers.TestInvoker$MethodInvocationAgent.invoke(TestInvoker.java:961)
	at org.testng.internal.invokers.TestInvoker.invokeTestMethods(TestInvoker.java:201)
	at org.testng.internal.invokers.TestMethodWorker.invokeTestMethods(TestMethodWorker.java:148)
	at org.testng.internal.invokers.TestMethodWorker.run(TestMethodWorker.java:128)
	at java.base/java.util.ArrayList.forEach(ArrayList.java:1596)
	at org.testng.TestRunner.privateRun(TestRunner.java:819)
	at org.testng.TestRunner.run(TestRunner.java:619)
	at org.testng.SuiteRunner.runTest(SuiteRunner.java:443)
	at org.testng.SuiteRunner.runSequentially(SuiteRunner.java:437)
	at org.testng.SuiteRunner.privateRun(SuiteRunner.java:397)
	at org.testng.SuiteRunner.run(SuiteRunner.java:336)
	at org.testng.SuiteRunnerWorker.runSuite(SuiteRunnerWorker.java:52)
	at org.testng.SuiteRunnerWorker.run(SuiteRunnerWorker.java:95)
	at org.testng.TestNG.runSuitesSequentially(TestNG.java:1301)
	at org.testng.TestNG.runSuitesLocally(TestNG.java:1228)
	at org.testng.TestNG.runSuites(TestNG.java:1134)
	at org.testng.TestNG.run(TestNG.java:1101)
	at org.apache.maven.surefire.testng.TestNGExecutor.run(TestNGExecutor.java:155)
	at org.apache.maven.surefire.testng.TestNGDirectoryTestSuite.executeMulti(TestNGDirectoryTestSuite.java:169)
	at org.apache.maven.surefire.testng.TestNGDirectoryTestSuite.execute(TestNGDirectoryTestSuite.java:88)
	at org.apache.maven.surefire.testng.TestNGProvider.invoke(TestNGProvider.java:137)
	at org.apache.maven.surefire.booter.ForkedBooter.runSuitesInProcess(ForkedBooter.java:385)
	at org.apache.maven.surefire.booter.ForkedBooter.execute(ForkedBooter.java:162)
	at org.apache.maven.surefire.booter.ForkedBooter.run(ForkedBooter.java:507)
	at org.apache.maven.surefire.booter.ForkedBooter.main(ForkedBooter.java:495)

[INFO] 
[INFO] Results:
[INFO] 
[ERROR] Failures: 
[ERROR]   LoginTest.testCorrectEmailWrongPassword:80->assertStatusContains:275 expected [true] but found [false]
[ERROR]   LoginTest.testEnterKeySubmission:219->assertStatusContains:275 expected [true] but found [false]
[ERROR]   LoginTest.testHTMLInjection:161->assertStatusContains:275 expected [true] but found [false]
[ERROR]   LoginTest.testInvalidLogin:74->assertStatusContains:275 expected [true] but found [false]
[ERROR]   LoginTest.testLeadingTrailingSpaces:133->assertStatusContains:275 expected [true] but found [false]
[ERROR]   LoginTest.testRegistrationSuccess:178->assertStatusContains:275 expected [true] but found [false]
[ERROR]   LoginTest.testSQLInjection:149->assertStatusContains:275 expected [true] but found [false]
[ERROR]   LoginTest.testUnicodeCharacters:139->assertStatusContains:275 expected [true] but found [false]
[ERROR]   LoginTest.testValidLogin:68->assertStatusContains:275 expected [true] but found [false]
[ERROR]   LoginTest.testXSSInjection:155->assertStatusContains:275 expected [true] but found [false]
[INFO] 
[ERROR] Tests run: 19, Failures: 10, Errors: 0, Skipped: 0
[INFO] 
[INFO] ------------------------------------------------------------------------
[INFO] BUILD FAILURE
[INFO] ------------------------------------------------------------------------
[INFO] Total time:  29.067 s
[INFO] Finished at: 2026-02-21T21:27:43+05:30
[INFO] ------------------------------------------------------------------------
[ERROR] Failed to execute goal org.apache.maven.plugins:maven-surefire-plugin:3.2.3:test (default-test) on project login-form-testing: There are test failures.
[ERROR] 
[ERROR] Please refer to /Users/ganeshilluri/Documents/Skill Palaver Project/Maven_Testing_Project/target/surefire-reports for the individual test results.
[ERROR] Please refer to dump files (if any exist) [date].dump, [date]-jvmRun[N].dump and [date].dumpstream.
[ERROR] -> [Help 1]
[ERROR] 
[ERROR] To see the full stack trace of the errors, re-run Maven with the -e switch.
[ERROR] Re-run Maven using the -X switch to enable full debug logging.
[ERROR] 
[ERROR] For more information about the errors and possible solutions, please read the following articles:
[ERROR] [Help 1] http://cwiki.apache.org/confluence/display/MAVEN/MojoFailureException
